<!ELEMENT modulosDAM (moduloProfesional+)>
<!ELEMENT moduloProfesional (nombre, contenidos)>
<!ELEMENT nombre (#PCDATA)>
<!ELEMENT contenidos (unidadDidactica+)>
<!ELEMENT unidadDidactica (tipo, descripcion)>
<!ELEMENT tipo (#PCDATA)>
<!ELEMENT descripcion (#PCDATA)>